{
  "schema_version": "publication-manifest/v1",
  "project": "web-standards-review",
  "skill_id": "standards-vulnerability-intel-miner",
  "source": {
    "repository": "simoneonofri/standards-vulnerability-intel-miner",
    "repository_path": "standards-vulnerability-intel-miner",
    "commit": "a38aace7ef5dc47cfe1a1559b149c7957231de46"
  },
  "target_path": "skills/standards-vulnerability-intel-miner",
  "include_paths": [
    {
      "source": "catalog/intelligence-candidates.json",
      "target": "catalog/intelligence-candidates.json",
      "rights": {
        "source_class": "original",
        "rights_status": "maintainer-owned",
        "include_decision": "include"
      }
    },
    {
      "source": "references/schema.md",
      "target": "references/schema.md",
      "rights": {
        "source_class": "original",
        "rights_status": "maintainer-owned",
        "include_decision": "include"
      }
    },
    {
      "source": "scripts/query_catalog.py",
      "target": "scripts/query_catalog.py",
      "rights": {
        "source_class": "original",
        "rights_status": "maintainer-owned",
        "include_decision": "include"
      }
    },
    {
      "source": "tests/fixtures/crossref.json",
      "target": "tests/fixtures/crossref.json",
      "rights": {
        "source_class": "synthetic-fixture",
        "rights_status": "synthetic-approved",
        "include_decision": "include"
      }
    },
    {
      "source": "tests/fixtures/nvd.json",
      "target": "tests/fixtures/nvd.json",
      "rights": {
        "source_class": "synthetic-fixture",
        "rights_status": "synthetic-approved",
        "include_decision": "include"
      }
    },
    {
      "source": "tests/test_catalog.py",
      "target": "tests/test_catalog.py",
      "rights": {
        "source_class": "original",
        "rights_status": "maintainer-owned",
        "include_decision": "include"
      }
    }
  ],
  "maintainer_files": [
    {
      "source": "portable-entrypoints/standards-vulnerability-intel-miner.md",
      "target": "SKILL.md",
      "sha256": "sha256:d05c1e55748a67395137fd45d539dc9014f078aa4cd59d112b0b63e9319b55b1",
      "rights": {
        "source_class": "original",
        "rights_status": "maintainer-owned",
        "include_decision": "include"
      }
    },
    {
      "source": "portable-resources/standards-vulnerability-intel-miner/scripts/update_catalog.py",
      "target": "scripts/update_catalog.py",
      "sha256": "sha256:0fe2031bea4d08693d861ff1e51b5fada7b9858c902affb8047971b88c076418",
      "rights": {
        "source_class": "original",
        "rights_status": "maintainer-owned",
        "include_decision": "include"
      }
    }
  ],
  "normalizations": [
    {
      "path": "tests/test_catalog.py",
      "find": "        text=True,\n    )\n    assert len(json.loads(result.stdout)[\"selected\"]) == 1\n",
      "replace": "        text=True,\n    )\n    assert len(json.loads(result.stdout)[\"selected\"]) == 1\n\n\ndef test_fixture_sources_keep_request_url_separate_from_local_cache_path(tmp_path: Path) -> None:\n    import hashlib\n    document = run_update(tmp_path)\n    for source in document[\"sources\"]:\n        assert source[\"status\"] == \"fixture\"\n        assert source[\"request_url\"].startswith(\"https://\")\n        path = Path(source[\"cache_path\"])\n        assert source[\"content_sha256\"] == hashlib.sha256(path.read_bytes()).hexdigest()\n\n\ndef test_null_crossref_subjects_match_absent_optional_metadata() -> None:\n    import copy\n    import importlib.util\n    spec = importlib.util.spec_from_file_location(\"intel_update\", ROOT / \"scripts/update_catalog.py\")\n    module = importlib.util.module_from_spec(spec)\n    spec.loader.exec_module(module)\n    payload = json.loads((ROOT / \"tests/fixtures/crossref.json\").read_text())\n    for work in payload[\"message\"][\"items\"]:\n        work.pop(\"subject\", None)\n    absent = module.crossref_candidates(payload, \"browser credential origin\")\n    explicit_null = copy.deepcopy(payload)\n    for work in explicit_null[\"message\"][\"items\"]:\n        work[\"subject\"] = None\n    present = module.crossref_candidates(explicit_null, \"browser credential origin\")\n    assert present == absent\n",
      "expected_count": 1
    }
  ],
  "private_dependency_replacements": [],
  "human_review_decision": "publication_review_required",
  "expected_public_contracts": [],
  "rights_manifest_reference": "manifests/standards-vulnerability-intel-miner.publication.json#include_paths",
  "required_tests": [
    "boundary-audit",
    "resource-integrity",
    "portable-workflow"
  ],
  "exclude_paths": [
    "SKILL.md"
  ],
  "expected_output_digest": "sha256:7ead8cc7ea5e229fa455406762c3c3a82fe7cbac867bdd8b51a7257432756dee"
}
