{
  "schema_version": "publication-manifest/v1",
  "project": "web-standards-review",
  "skill_id": "what-are-we-going-to-do-about-it",
  "source": {
    "repository": "simoneonofri/what-are-we-going-to-do-about-it",
    "repository_path": "what-are-we-going-to-do-about-it",
    "commit": "46a10e58ae09e3450c9a16a3026dca8f8a01ae14"
  },
  "target_path": "skills/what-are-we-going-to-do-about-it",
  "host_projection": "portable",
  "include_paths": [
    {"source": "SKILL.public.md", "target": "SKILL.md", "rights": {"source_class": "original", "rights_status": "maintainer-owned", "include_decision": "include"}},
    {"source": "agents/openai.yaml", "rights": {"source_class": "original", "rights_status": "maintainer-owned", "include_decision": "include"}},
    {"source": "contracts/response-analysis-v1.md", "rights": {"source_class": "original", "rights_status": "maintainer-owned", "include_decision": "include"}},
    {"source": "scripts/validate_response_package.py", "rights": {"source_class": "original", "rights_status": "maintainer-owned", "include_decision": "include"}},
    {"source": "tests/test_response_package_validator.py", "rights": {"source_class": "original", "rights_status": "maintainer-owned", "include_decision": "include"}},
    {"source": "evals/fixtures/threat-package-valid.json", "rights": {"source_class": "synthetic-fixture", "rights_status": "synthetic-approved", "include_decision": "include"}},
    {"source": "evals/fixtures/valid-response-handoff.json", "rights": {"source_class": "synthetic-fixture", "rights_status": "synthetic-approved", "include_decision": "include"}},
    {"source": "evals/fixtures/accept-without-owner.json", "rights": {"source_class": "synthetic-fixture", "rights_status": "synthetic-approved", "include_decision": "include"}},
    {"source": "evals/fixtures/best-practice-response.json", "rights": {"source_class": "synthetic-fixture", "rights_status": "synthetic-approved", "include_decision": "include"}},
    {"source": "evals/fixtures/generic-keyword-response.json", "rights": {"source_class": "synthetic-fixture", "rights_status": "synthetic-approved", "include_decision": "include"}},
    {"source": "evals/fixtures/missing-baseline-response.json", "rights": {"source_class": "synthetic-fixture", "rights_status": "synthetic-approved", "include_decision": "include"}},
    {"source": "evals/fixtures/out-of-scope-response.json", "rights": {"source_class": "synthetic-fixture", "rights_status": "synthetic-approved", "include_decision": "include"}},
    {"source": "evals/fixtures/reduce-without-remaining.json", "rights": {"source_class": "synthetic-fixture", "rights_status": "synthetic-approved", "include_decision": "include"}},
    {"source": "evals/fixtures/threat-package-two.json", "rights": {"source_class": "synthetic-fixture", "rights_status": "synthetic-approved", "include_decision": "include"}},
    {"source": "evals/fixtures/transfer-without-receiver.json", "rights": {"source_class": "synthetic-fixture", "rights_status": "synthetic-approved", "include_decision": "include"}},
    {"source": "evals/fixtures/valid-eliminate.json", "rights": {"source_class": "synthetic-fixture", "rights_status": "synthetic-approved", "include_decision": "include"}},
    {"source": "evals/fixtures/valid-unresolved-coverage.json", "rights": {"source_class": "synthetic-fixture", "rights_status": "synthetic-approved", "include_decision": "include"}}
  ],
  "normalizations": [
    {"path": "scripts/validate_response_package.py", "action": "portable_contract_resolution_v1", "expected_count": 1},
    {"path": "SKILL.md", "find": "## Status\n", "replace": "<!-- section:status -->\n## Status\n", "expected_count": 1},
    {"path": "SKILL.md", "find": "## Contract\n", "replace": "<!-- section:contract protected -->\n## Contract\n", "expected_count": 1},
    {"path": "SKILL.md", "find": "## Boundary\n", "replace": "<!-- section:boundary -->\n## Boundary\n", "expected_count": 1},
    {"path": "SKILL.md", "find": "## Contract Resolution\n", "replace": "<!-- section:contract-resolution protected -->\n## Contract Resolution\n", "expected_count": 1},
    {"path": "SKILL.md", "find": "## Artifact Root\n", "replace": "<!-- section:artifact-root -->\n## Artifact Root\n", "expected_count": 1},
    {"path": "SKILL.md", "find": "## Required Inputs\n", "replace": "<!-- section:required-inputs -->\n## Required Inputs\n", "expected_count": 1},
    {"path": "SKILL.md", "find": "## Source Boundary\n", "replace": "<!-- section:source-boundary -->\n## Source Boundary\n", "expected_count": 1},
    {"path": "SKILL.md", "find": "## Response Record\n", "replace": "<!-- section:response-record -->\n## Response Record\n", "expected_count": 1},
    {"path": "SKILL.md", "find": "## ERTA Decisions\n", "replace": "<!-- section:erta-decisions -->\n## ERTA Decisions\n", "expected_count": 1},
    {"path": "SKILL.md", "find": "## Current And Proposed Responses\n", "replace": "<!-- section:current-and-proposed-responses -->\n## Current And Proposed Responses\n", "expected_count": 1},
    {"path": "SKILL.md", "find": "## Owners, Assumptions, And Remaining Threats\n", "replace": "<!-- section:owners-assumptions-and-remaining-threats -->\n## Owners, Assumptions, And Remaining Threats\n", "expected_count": 1},
    {"path": "SKILL.md", "find": "## Workflow\n", "replace": "<!-- section:workflow -->\n## Workflow\n", "expected_count": 1},
    {"path": "SKILL.md", "find": "## Validation\n", "replace": "<!-- section:validation -->\n## Validation\n", "expected_count": 1},
    {"path": "SKILL.md", "find": "## Output\n", "replace": "<!-- section:output -->\n## Output\n", "expected_count": 1},
    {"path": "SKILL.md", "find": "## Handoff\n", "replace": "<!-- section:handoff -->\n## Handoff\n", "expected_count": 1},
    {"path": "SKILL.md", "find": "## Remote-Write Boundary\n", "replace": "<!-- section:remote-write-boundary protected -->\n## Remote-Write Boundary\n", "expected_count": 1},
    {"path": "SKILL.md", "find": "2. repository-local `schemas/threat-model-contract-v1/`;", "replace": "2. package-local `contracts/shared-contract-v1.json`, which identifies the canonical schemas and validator;", "expected_count": 1},
    {"path": "SKILL.md", "find": "3. sibling `web-standards-review-contracts` package;", "replace": "3. the bundled `contracts/threat-modeling-flow-v1/` tree;", "expected_count": 1},
    {"path": "SKILL.md", "find": "4. a caller-supplied contract path.", "replace": "4. a caller-supplied contract path.\n\nResolve package-local paths from the physical installed skill path, following any host symlink, rather than from the caller workspace.", "expected_count": 1},
    {"path": "scripts/validate_response_package.py", "find": "            str(response.get(field, \"\"))\n            for field in (\"response\", \"mechanism_or_text\")\n        ).strip()\n        if GENERIC_RESPONSE_RE.search(combined):\n            errors.append(f\"{label}: generic keyword-routing text is not a specific response\")\n    return errors\n\n", "replace": "            str(response.get(field, \"\"))\n            for field in (\"response\", \"mechanism_or_text\")\n        ).strip()\n        if GENERIC_RESPONSE_RE.search(combined) or GENERIC_RESPONSE_RE.fullmatch(str(mechanism or \"\").strip()):\n            errors.append(f\"{label}: generic keyword-routing text is not a specific response\")\n    return errors\n\n", "expected_count": 1},
    {"path": "tests/test_response_package_validator.py", "find": "        \"--allow-subset\",\n    )\n    assert result.returncode == 0, result.stdout + result.stderr\n", "replace": "        \"--allow-subset\",\n    )\n    assert result.returncode == 0, result.stdout + result.stderr\n\n\ndef test_generic_mechanism_is_not_hidden_by_response_summary():\n    package = load_valid_package()\n    package[\"responses\"][0].update(response=\"Mitigate\", mechanism_or_text=\"validate inputs\")\n    errors = MODULE.validate_specific_responses(package)\n    assert any(\"generic keyword-routing text\" in error for error in errors)\n\n\ndef test_short_summary_can_use_a_concrete_threat_specific_mechanism():\n    package = load_valid_package()\n    package[\"responses\"][0][\"response\"] = \"Validate inputs\"\n    assert MODULE.validate_specific_responses(package) == []\n\n\ndef test_specific_mechanism_is_not_rejected_for_a_generic_introductory_phrase():\n    package = load_valid_package()\n    package[\"responses\"][0].update(response=\"Reject replayed requests\", mechanism_or_text=\"Improve security by rejecting stale transaction identifiers before processing the request.\")\n    assert MODULE.validate_specific_responses(package) == []\n", "expected_count": 1}
  ],
  "private_dependency_replacements": [{"dependency": "maintainer method provider", "replacement": "method-provider interface; no private corpus is required by the portable validator"}],
  "provider_interfaces": ["ReviewEvidenceProvider", "MethodKnowledgeProvider", "ArtifactStore"],
  "human_review_decision": "publication_review_required",
  "rights_manifest_reference": "manifests/what-are-we-going-to-do-about-it.publication.json#include_paths",
  "rights_pending": ["Human rights and allowlist review is required before publication."],
  "expected_public_contracts": ["threat-package/v1", "response-package/v1"],
  "required_tests": ["boundary-audit", "isolated-unit-tests"],
  "expected_output_digest": "sha256:e1486d37f2d611fb72298f38a9ef57d9882c5708ebc90a5e7f8c498da3052a6a"
}
